{
  "evidence_schema": "1.0",
  "checker": {
    "id": "pii-flow",
    "version": "pii-flow-souffle-1"
  },
  "input_hash": "sha256:06da2492ce48807bc9f38eaae97a48f81cce47e7f92eb7fbc4367901462fc992",
  "runtime_closure": "sha256:badade865809bc90e3077981472c36fb58df58b7479bb3b340b75e745efb48af",
  "verdict": "pass",
  "coverage": [
    {
      "element": "inv:priv-no-unredacted-export",
      "verdict": "pass",
      "detail": "souffle derived no leak tuple: no sensitive attribute reaches a sink unredacted"
    }
  ],
  "findings": [],
  "attestation": {
    "engine": "souffle",
    "engine_version": "2.5",
    "rules_sha256": "sha256:367aa619827d673ed4d81c8cf93801e6429ccb193806226642d1179c36e34992"
  },
  "trace_ref": "generated/souffle-outputs.json"
}
